{
  "fixture_version": 1,
  "contract": "V2-028",
  "read_contract": "V2-001",
  "execution_state": "pure_contract_models_no_sync_runtime",
  "rules": {
    "poll": "sync takes exactly project, projection=summary, limit (1..100), and a nonempty opaque cursor. No arbitrary view/status/assignee filters. A completed checkpoint starts a poll by capturing H; an incomplete continuation preserves H. Success is the v2 envelope with source_checkpoint (echo of request.cursor), high_water, through, complete, replacements, next_cursor. next_cursor is always nonempty: incomplete means continue the fixed H; complete means checkpoint at H for a later poll with a new H.",
    "coverage": "Positions and the durable retention floor F are store-global within one generation; project selects rows and binds cursors but never narrows floor or high water. Validate F <= C <= H <= durable high water. C==F is valid; C<F returns invalid_cursor reason expired with restart_required=true. Select retained matching rows in (C,H], coalesce only consumed rows, and when another matching row remains set through to last consumed R; otherwise set through=H, even for empty/other-project-only windows. Gaps in committed sequence allocation are permitted; positions are never reused.",
    "hydration": "Return each consumed identity once per chunk as kind=upsert plus a complete V2-001 summary, including explicit null clears. Select journal coverage and hydrate current summaries in one short read transaction. Hydration can be newer than fixed H: through is coverage, not historical visibility. An unexpectedly missing current item is corruption, never an inferred tombstone. Reject is an upsert, not deletion.",
    "bounds": "Bound matching journal rows consumed to at most 100, output items to request.limit<=100, and compact UTF-8 response bytes to 1048576; sentinel examination is bounded separately (at most one extra matching row) and is never consumed. Test journal_limit is an internal smaller bound, not a wire option. Conservative chunks may consume at most min(journal_limit,limit) rows; coalescing need not fill an item page. Never skip unconsumed rows to fill output. On byte overflow shorten the consumed prefix and recompute coalescing/through, or return payload_too_large without any checkpoint advance if one full replacement cannot fit. Never truncate fields or emit partial success.",
    "cursor": "Handles in tokens are illustrative, opaque and not runtime-generated. The test-only decoded semantics freeze kind, store_id, persisted generation, project, summary schema version, covered through, and fixed high_water for incomplete polls (null for completed checkpoints). Scan continuation additionally binds immutable identity boundary and original sync starting checkpoint. Clients must not construct, decode, sort or alter tokens. Tokens are continuation data, not authorization; every request retains normal authorization. Encoding is not frozen by these example handles.",
    "scan": "scan takes exactly project, projection=summary, limit (1..100), cursor (null starts). Success is v2 envelope result items, next_cursor (null on exhaustion), sync_start_cursor (same opaque checkpoint on every page, including empty). Capture sync start S before scanning the first primary row in that read transaction. Scan all project summaries in ascending immutable canonical requester/project/numeric item sequence order, not queue priority/time; it is live and not a historical snapshot. Bind scope/generation/start to continuation, check S against the global floor on every page and catch-up poll, then replay from S toward a chosen finite H before publishing. Expiry or generation change requires discarding staging and restarting bootstrap. Reconciliation replaces old baseline contents, including absent items, rather than unioning them.",
    "consumer": "One in-flight poll per mirror. The client owns baseline and a fresh local bootstrap identity; accept only if baseline exists and echoed source checkpoint plus captured local bootstrap identity equal persisted values. Apply higher revisions as full replacements; ignore lower revisions; equivalent same-revision replay is harmless; conflicting same-revision data fails the whole commit. Atomically persist replacements and next cursor. Discard delayed responses from old checkpoints or bootstrap identities. Baseline loss requires bootstrap even if the cursor remains and the delta is empty. Derive ready/mine queues from project state, not by filtering the feed.",
    "atomicity": "An effective committed item operation appends exactly one operation-linked change record in the existing item/audit/receipt transaction and updates durable high water there. Compound component events do not multiply appends; a note-only revision change appends once. Idempotent replay and genuine no-op append nothing. Pruning is explicit transactional prefix pruning: F and durable high water never decrease within a generation, prune-all preserves high water and generation, restart preserves metadata, subsequent commits allocate above all prior committed positions. Each cursor-dependent storage read obtains generation, floor, high-water/coverage metadata, selected rows and hydration from the same read transaction; maintenance is wholly before or after its snapshot.",
    "recovery": "Initial tracking activation creates a persisted independent random 128-bit generation, high water=0, floor=0 and requires full bootstrap. No timestamp-ordered audit backfill and no rewriting old audit/receipts. Sync stays disabled until supported writers all journal. Every supported offline restore, including repeated restore of the identical backup, persists a fresh independently OS-random 128-bit generation, not a counter or backup-derived value. Collision probability is assumed negligible, not mathematically impossible. Restored content may have identical item revisions; generation rejects all previous tokens anyway. Ordinary process restart preserves persisted store identity/generation and tokens. Supported restore requires stopping warm sessions, SQLite-consistent backup/restore and integrity validation; silent out-of-band replacement detection is not promised.",
    "errors": "Use existing v2 error envelope api_version=2,schema_version=1,ok=false,error={code,message,details}. Reject cursor kind/store/project/schema/version mismatch, malformed/future positions, generation mismatch, and expired coverage explicitly with invalid_cursor details reason and restart_required=true. Generation-less page/history/scan/sync tokens return invalid_cursor details {reason:generation_missing,restart_required:true}. Generation-less validators return invalid_input details {reason:generation_missing,refetch_required:true}; changed generation validators also refetch and never return not_modified, even for restored content at the same revision. Warm sessions fail identity checks and request restart before another read or mutation is accepted. Missing baseline is client bootstrap_required, not a server not_modified or empty-queue success."
  },
  "activation": {
    "new_generation": "17c4607f59e849e584627308cf9e1711",
    "initial_high_water": 0,
    "initial_floor": 0,
    "full_bootstrap_required": true,
    "timestamp_audit_backfill": false,
    "sync_enabled_before_all_writers_participate": false,
    "after_operations_high_water": 7
  },
  "operations": [
    {"id": "capture-a", "kind": "capture", "item_id": "ALICE:bif:001", "project": "bif", "effective": true, "replay": false, "before_revision": 0, "after_revision": 1, "component_events": 1, "expected_high_water": 1},
    {"id": "note-a", "kind": "note_only", "item_id": "ALICE:bif:001", "project": "bif", "effective": true, "replay": false, "before_revision": 1, "after_revision": 2, "component_events": 1, "expected_high_water": 2},
    {"id": "triage-a", "kind": "compound", "item_id": "ALICE:bif:001", "project": "bif", "effective": true, "replay": false, "before_revision": 2, "after_revision": 3, "component_events": 3, "expected_high_water": 3},
    {"id": "capture-b", "kind": "capture", "item_id": "ALICE:bif:002", "project": "bif", "effective": true, "replay": false, "before_revision": 0, "after_revision": 1, "component_events": 1, "expected_high_water": 4},
    {"id": "start-clear-a", "kind": "mutation", "item_id": "ALICE:bif:001", "project": "bif", "effective": true, "replay": false, "before_revision": 3, "after_revision": 4, "component_events": 3, "expected_high_water": 5},
    {"id": "capture-other", "kind": "capture", "item_id": "ALICE:other:001", "project": "other", "effective": true, "replay": false, "before_revision": 0, "after_revision": 1, "component_events": 1, "expected_high_water": 6},
    {"id": "retry-start-a", "kind": "replay", "item_id": "ALICE:bif:001", "project": "bif", "effective": true, "replay": true, "before_revision": 4, "after_revision": 4, "component_events": 0, "expected_high_water": 6},
    {"id": "same-value-a", "kind": "noop", "item_id": "ALICE:bif:001", "project": "bif", "effective": false, "replay": false, "before_revision": 4, "after_revision": 4, "component_events": 0, "expected_high_water": 6},
    {"id": "capture-before-scan-boundary", "kind": "capture", "item_id": "AARON:bif:001", "project": "bif", "effective": true, "replay": false, "before_revision": 0, "after_revision": 1, "component_events": 1, "expected_high_water": 7}
  ],
  "journal": [
    {"change_seq": 1, "operation_id": "capture-a", "item_id": "ALICE:bif:001", "project": "bif", "revision": 1},
    {"change_seq": 2, "operation_id": "note-a", "item_id": "ALICE:bif:001", "project": "bif", "revision": 2},
    {"change_seq": 3, "operation_id": "triage-a", "item_id": "ALICE:bif:001", "project": "bif", "revision": 3},
    {"change_seq": 4, "operation_id": "capture-b", "item_id": "ALICE:bif:002", "project": "bif", "revision": 1},
    {"change_seq": 5, "operation_id": "start-clear-a", "item_id": "ALICE:bif:001", "project": "bif", "revision": 4},